Title, Genre, Developer, Publisher, Launch Date, User Approval, Description, Link
Dreaming Sarah, "Adventure, Casual, Indie", "Andre Chagas Silva y	Anthony Septim", Asteristic Game Studio, 12 March 2015, 93%+, "Inspired by the horror game Yume Nikki, Dreaming Sarah is a surreal adventure platformer game with puzzle elements, an engaging environment, an incredibly diverse cast of characters, and of course, a young girl named Sarah. Sarah has been on an accident and is in a coma. It's up to you help her wake up by exploring her dream world while collecting items, talking to weird characters and exploring the world around her!", http://cdn.edgecast.steamstatic.com/steam/apps/296870/header.jpg
Child of Light, "RPG, Fantasy", "Ubisoft Montréal", Ubisoft, 30 April 2014, 87%+, "Aurora, a young girl from 1895 Austria, awakens on the lost fairytale continent of Lemuria. To return home she must fight against the dark creatures of the Queen of the Night, who have stolen the sun, the moon and the stars. At stake is not only Lemuria, but Aurora’s true destiny.", http://cdn.edgecast.steamstatic.com/steam/apps/256290/header.jpg
Fallout: New Vegas, "Action, RPG", Obsidian Entretainment, Bethesda Softworks, 19 October 2010, 95%+, "Welcome to Vegas. New Vegas. It’s the kind of town where you dig your own grave prior to being shot in the head and left for dead…and that’s before things really get ugly. It’s a town of dreamers and desperados being torn apart by warring factions vying for complete control of this desert oasis. It’s a place where the right kind of person with the right kind of weaponry can really make a name for themselves, and make more than an enemy or two along the way. As you battle your way across the heat-blasted Mojave Wasteland, the colossal Hoover Dam, and the neon drenched Vegas Strip, you’ll be introduced to a colorful cast of characters, power-hungry factions, special weapons, mutated creatures and much more. Choose sides in the upcoming war or declare “winner takes all” and crown yourself the King of New Vegas in this follow-up to the 2008 videogame of the year, Fallout 3. Enjoy your stay.", http://cdn.edgecast.steamstatic.com/steam/apps/22380/header.jpg
Civilization V, "Strategy", Firaxis Games, 2K Games, 23 September 2010, 95%+, "Become Ruler of the World by establishing and leading a civilization from the dawn of man into the space age: Wage war, conduct diplomacy, discover new technologies, go head-to-head with some of history’s greatest leaders and build the most powerful empire the world has ever known.", http://cdn.edgecast.steamstatic.com/steam/apps/8930/header.jpg
Night in the Woods, Aventura, Infinite Fall , Finji,21 feb. 2017,95% +++,"NIGHT IN THE WOODS is an adventure game focused on exploration, story, and character, featuring dozens of characters to meet and lots to do across a lush, vibrant world.",http://cdn.edgecast.steamstatic.com/steam/apps/481510/header.jpg
Amnesia: The Dark Descent,"Acción, Aventura, Indie",Frictional Games ,Frictional Games , 8 sep. 2010,96%+++,"Amnesia: The Dark Descent, a first person survival horror. A game about immersion, discovery and living through a nightmare. An experience that will chill you to the core.",http://cdn.edgecast.steamstatic.com/steam/apps/57300/header.jpg
Alice: Madness Returns,"Acción, Aventura",Spicy Horse Games, Electronic Arts,14 jun.2011,87%++, X , http://cdn.edgecast.steamstatic.com/steam/apps/19680/header.jpg
Life Is Strange,"Acción, Aventura","DONTNOD Entertainment, Feral Interactive (Mac) , Feral Interactive (Linux)","Square Enix, Feral interactive (Mac), Feral Interactive (Linux)",29 ene. 2015,96% +++,X,http://cdn.edgecast.steamstatic.com/steam/apps/319630/header.jpg
